{
  "caseId": "bc_1776997463483_fd433c",
  "baselineCaseScore": 0.65,
  "baselineObjectiveScore": 0.64,
  "baselineSubjectiveScore": 0.66,
  "baselineRiskPenaltyScore": 0.66,
  "baselineSignals": [
    {
      "signalKey": "interestDeclineRisk",
      "score": 0.76,
      "severity": "high"
    },
    {
      "signalKey": "understandingBarrierRisk",
      "score": 0.2,
      "severity": "low"
    },
    {
      "signalKey": "emotionRecoveryFailureRisk",
      "score": 0.22,
      "severity": "low"
    }
  ],
  "baselineGeneratedAt": "2026-04-24T02:24:23.486Z",
  "baselineProductVersion": "smoke_remediation_001"
}
